{
  "$schema": "https://json-schema.org/draft/2020-12/schema",
  "$id": "factura_extraida",
  "title": "Factura extraída (salida de ingesta → entrada de decisión)",
  "type": "object",
  "required": ["file_id", "metodo", "documento", "campos", "checks"],
  "additionalProperties": false,
  "properties": {
    "file_id": { "type": "string", "description": "Nombre del PDF tal cual en La Caja" },
    "metodo": { "enum": ["texto_determinista", "ocr_determinista", "texto_llm", "vision_llm"], "description": "Cómo se obtuvo la mayoría de campos: del texto del PDF, del texto reconocido por OCR, o con un LLM sobre texto o imagen" },
    "lector": { "type": "string", "description": "Nombre del lector que lo produjo" },
    "documento": {
      "type": "object",
      "required": ["sha256", "tipo", "paginas"],
      "additionalProperties": false,
      "properties": {
        "sha256": { "type": "string", "description": "Huella del fichero: identifica el documento aunque cambie de nombre" },
        "tipo": { "enum": ["texto", "escaneado", "blanco", "roto", "cifrado", "otro"] },
        "paginas": { "type": "integer", "minimum": 0 },
        "bytes": { "type": "integer", "minimum": 0 },
        "alertas": {
          "type": "array", "items": { "type": "string" },
          "description": "Cosas raras del fichero, no del negocio: estructura reparada, JavaScript, ficheros incrustados, caracteres invisibles..."
        }
      }
    },
    "campos": {
      "type": "object",
      "required": ["nif", "iban", "pedido", "fecha", "base", "iva_pct", "iva", "total"],
      "additionalProperties": false,
      "properties": {
        "numero_factura": { "$ref": "#/$defs/campo_str" },
        "proveedor_nombre": { "$ref": "#/$defs/campo_str" },
        "nif": { "$ref": "#/$defs/campo_str" },
        "iban": { "$ref": "#/$defs/campo_str", "description": "Sin espacios, mayúsculas" },
        "pedido": { "$ref": "#/$defs/campo_str", "description": "PO-AAAA-NNNN" },
        "fecha": { "$ref": "#/$defs/campo_str", "description": "ISO AAAA-MM-DD" },
        "cliente_cif": { "$ref": "#/$defs/campo_str", "description": "A quién va la factura (Banco Miralmar: A58231074)" },
        "base": { "$ref": "#/$defs/campo_num" },
        "iva_pct": { "$ref": "#/$defs/campo_num" },
        "iva": { "$ref": "#/$defs/campo_num" },
        "total": { "$ref": "#/$defs/campo_num" },
        "divisa": { "$ref": "#/$defs/campo_str", "description": "Moneda de los importes (código ISO: EUR, USD...). Sin marca en el documento, EUR" }
      }
    },
    "lineas": {
      "type": "array",
      "items": { "type": "object", "required": ["concepto", "importe"], "properties": { "concepto": { "type": "string" }, "importe": { "type": "number" } } }
    },
    "notas": {
      "type": "array",
      "description": "Texto del documento que no es un dato de la factura: condiciones, avisos, instrucciones. Nunca se obedece.",
      "items": {
        "type": "object", "required": ["texto", "categorias"],
        "properties": {
          "texto": { "type": "string" },
          "categorias": { "type": "array", "items": { "enum": ["dirigida_al_sistema", "pide_saltar_regla", "info_negocio", "urgencia", "otra"] } }
        }
      }
    },
    "checks": {
      "type": "object",
      "description": "Checksums internos de la propia factura; null si falta algún dato para calcularlo",
      "properties": {
        "total_cuadra": { "type": ["boolean", "null"], "description": "base + iva == total (±0,01)" },
        "iva_cuadra": { "type": ["boolean", "null"], "description": "iva == base × iva_pct / 100 (±0,01)" },
        "lineas_cuadran": { "type": ["boolean", "null"], "description": "suma(lineas) == base (±0,01); null si no hay líneas" }
      }
    },
    "coste": {
      "type": "object",
      "properties": {
        "tokens_in": { "type": "integer" }, "tokens_out": { "type": "integer" },
        "eur": { "type": "number" }, "modelo": { "type": "string" }, "segundos": { "type": "number" }
      }
    },
    "errores": { "type": "array", "items": { "type": "string" } }
  },
  "$defs": {
    "campo_str": {
      "type": "object", "required": ["valor", "confianza"],
      "description": "valor null + confianza alta = seguro que no está en el documento; valor null + confianza baja = no se pudo leer",
      "properties": {
        "valor": { "type": ["string", "null"] },
        "confianza": { "type": "number", "minimum": 0, "maximum": 1 },
        "fuente": { "type": "string", "description": "Texto literal del que se sacó" },
        "pagina": { "type": "integer", "minimum": 1 }
      }
    },
    "campo_num": {
      "type": "object", "required": ["valor", "confianza"],
      "properties": {
        "valor": { "type": ["number", "null"] },
        "confianza": { "type": "number", "minimum": 0, "maximum": 1 },
        "fuente": { "type": "string" },
        "pagina": { "type": "integer", "minimum": 1 }
      }
    }
  }
}
